{
  "version": "1.0",
  "state_schema_version": "1.0.0",
  "episode": {
    "id": "ep_20250101_120000_123456_abcd_s0",
    "seed": 0,
    "started_at": "2025-01-01T12:00:00+00:00",
    "tags": {
      "env": "demo"
    },
    "using": "adapter:demo"
  },
  "goal": {
    "task": "Investigate incident impact",
    "type": "task",
    "context": "Service latency alerts from region us-east-1"
  },
  "beliefs": [
    {
      "statement": "Latency spike correlates with deploy v2025.1.0",
      "confidence": 0.7,
      "timestamp": "2025-01-01T12:00:05+00:00",
      "provenance": {
        "source": "detector",
        "evidence_ids": [
          "evt-deploy-signal"
        ],
        "adapter_id": "adapter:demo"
      }
    }
  ],
  "plan": {
    "steps": [
      {
        "id": "step-1",
        "kind": "detect",
        "description": "Collect recent deploy metadata",
        "status": "done"
      },
      {
        "id": "step-2",
        "kind": "act",
        "description": "Compare latency pre/post deploy",
        "status": "done",
        "depends_on": [
          "step-1"
        ]
      },
      {
        "id": "step-3",
        "kind": "verify",
        "description": "Confirm mitigation plan",
        "status": "pending",
        "depends_on": [
          "step-2"
        ]
      }
    ],
    "source": "system",
    "updated_at": "2025-01-01T12:00:07+00:00",
    "rationale": "Minimal planner (detector → action → verify)"
  },
  "memory": {
    "facts": [
      {
        "type": "metric",
        "key": "latency_p99_ms",
        "value": 840,
        "timestamp": "2025-01-01T12:00:08+00:00",
        "provenance": {
          "source": "telemetry",
          "adapter_id": "adapter:demo"
        }
      }
    ],
    "scratchpad": "Deploy rollback in progress."
  },
  "outcomes": {
    "status": "ok",
    "summary": "Rollback reduced latency below threshold.",
    "actions": [
      {
        "id": "act-1",
        "kind": "adapter",
        "tool": "adapter:demo",
        "input_excerpt": "rollback deploy v2025.1.0",
        "result_status": "ok",
        "timestamp": "2025-01-01T12:00:10+00:00",
        "step_id": "step-2",
        "result_artifacts": [
          {
            "type": "log",
            "uri": ".noesis/episodes/ep_20250101_120000_123456_abcd_s0/rollback.log"
          }
        ]
      }
    ],
    "metrics": {
      "task_score": 0.85
    },
    "artifacts": [
      {
        "type": "report",
        "uri": ".noesis/episodes/ep_20250101_120000_123456_abcd_s0/report.md"
      }
    ]
  },
  "links": {
    "events": "events.jsonl",
    "summary": "summary.json",
    "learn": "learn.jsonl"
  }
}
